{"SchemaVersion":"amd-chipset-public-release-index/1.0","ToolkitVersion":"2.0.0","GeneratedAtUtc":"2026-08-12T06:11:40.1137364Z","CanonicalRawData":"inventory/releases/**/amd-chipset-analysis-*.json","ReleaseCount":25,"Releases":[{"ReleaseVersion":"2.04.04.111","AnalysisFile":"releases/2.04.04.111/amd-chipset-analysis-2.04.04.111.json","AnalysisSha256":"b7dee7f9511a46bcbbf64914945273672f4db112cade749da6215184d4471b71","DriverPackageCount":24,"ProductRecordCount":26,"DevIdRuleCount":0},{"ReleaseVersion":"3.08.17.735","AnalysisFile":"releases/3.08.17.735/amd-chipset-analysis-3.08.17.735.json","AnalysisSha256":"10171f833c42ac8729086923be6a9cd76140ce76df97168a38dadb668fe54ba2","DriverPackageCount":16,"ProductRecordCount":15,"DevIdRuleCount":0},{"ReleaseVersion":"3.09.01.140","AnalysisFile":"releases/3.09.01.140/amd-chipset-analysis-3.09.01.140.json","AnalysisSha256":"46c68bac25049d87806126e82c30f3fc43d29e916d9173dc20977246cb6d862b","DriverPackageCount":16,"ProductRecordCount":15,"DevIdRuleCount":0},{"ReleaseVersion":"3.10.08.506","AnalysisFile":"releases/3.10.08.506/amd-chipset-analysis-3.10.08.506.json","AnalysisSha256":"e079e26fbaec089225341fa2cc519c2e4abe05236619e0136b25677bc21b0b03","DriverPackageCount":16,"ProductRecordCount":27,"DevIdRuleCount":0},{"ReleaseVersion":"4.03.03.431","AnalysisFile":"releases/4.03.03.431/amd-chipset-analysis-4.03.03.431.json","AnalysisSha256":"5b8fb03b9c5e1ee297b903e624ed4e4ab985968857ed92c358dcff462c82455f","DriverPackageCount":16,"ProductRecordCount":28,"DevIdRuleCount":0},{"ReleaseVersion":"4.06.10.651","AnalysisFile":"releases/4.06.10.651/amd-chipset-analysis-4.06.10.651.json","AnalysisSha256":"d5bea433d3ea3197123161af9bd20eabecbb272a91050d90f0d905983759c607","DriverPackageCount":24,"ProductRecordCount":39,"DevIdRuleCount":0},{"ReleaseVersion":"4.08.09.2337","AnalysisFile":"releases/4.08.09.2337/amd-chipset-analysis-4.08.09.2337.json","AnalysisSha256":"c934dc5948867ab1fe2fac6ca7a097c931e272588d19cd5111a904dccddc1b20","DriverPackageCount":24,"ProductRecordCount":39,"DevIdRuleCount":0},{"ReleaseVersion":"4.09.23.507","AnalysisFile":"releases/4.09.23.507/amd-chipset-analysis-4.09.23.507.json","AnalysisSha256":"4f1dca19e9e7d03e05e08e604e80ccd08915348ce62af7c14bc31e2c136e48c0","DriverPackageCount":24,"ProductRecordCount":39,"DevIdRuleCount":0},{"ReleaseVersion":"4.11.15.342","AnalysisFile":"releases/4.11.15.342/amd-chipset-analysis-4.11.15.342.json","AnalysisSha256":"8c70cadc29b05ad1cb0bfa3ddc4953b832004a4ff06f5ad3c266949a08587e65","DriverPackageCount":24,"ProductRecordCount":39,"DevIdRuleCount":0},{"ReleaseVersion":"5.02.19.2221","AnalysisFile":"releases/5.02.19.2221/amd-chipset-analysis-5.02.19.2221.json","AnalysisSha256":"658dd3f6b5d68231f91e78f661bea91f7a601e65ff687449902884af9c35dac3","DriverPackageCount":25,"ProductRecordCount":41,"DevIdRuleCount":0},{"ReleaseVersion":"5.05.16.529","AnalysisFile":"releases/5.05.16.529/amd-chipset-analysis-5.05.16.529.json","AnalysisSha256":"79d53c163f741ffbf43da27479988b7b856fdd2561e2cef21633ec912fb5da40","DriverPackageCount":26,"ProductRecordCount":41,"DevIdRuleCount":0},{"ReleaseVersion":"5.08.02.027","AnalysisFile":"releases/5.08.02.027/amd-chipset-analysis-5.08.02.027.json","AnalysisSha256":"a52e5716d238bc629e1c1c5767dd9db0dc28bf824b352dc6ac28aad2a3c61ce0","DriverPackageCount":27,"ProductRecordCount":47,"DevIdRuleCount":0},{"ReleaseVersion":"6.01.25.342","AnalysisFile":"releases/6.01.25.342/amd-chipset-analysis-6.01.25.342.json","AnalysisSha256":"3297f3be4c7a1429a8bcca6ed234f4e64c73732c71f737cd46570f5605b3bb43","DriverPackageCount":27,"ProductRecordCount":48,"DevIdRuleCount":0},{"ReleaseVersion":"6.02.07.2300","AnalysisFile":"releases/6.02.07.2300/amd-chipset-analysis-6.02.07.2300.json","AnalysisSha256":"fdb05f9c7f788d98bec6234f2b0dd72b901eec7b124c427e860fcfd6c7cbb79b","DriverPackageCount":27,"ProductRecordCount":48,"DevIdRuleCount":0},{"ReleaseVersion":"6.05.28.016","AnalysisFile":"releases/6.05.28.016/amd-chipset-analysis-6.05.28.016.json","AnalysisSha256":"d067c680c3b59cb9f1c514775d09f7c3817240ee0014fb206608fa78db9961a7","DriverPackageCount":28,"ProductRecordCount":52,"DevIdRuleCount":0},{"ReleaseVersion":"6.07.22.037","AnalysisFile":"releases/6.07.22.037/amd-chipset-analysis-6.07.22.037.json","AnalysisSha256":"bd2c8aa462e739af72bb7dd993950f303535c96d8bc898b466bab2840b2a76c7","DriverPackageCount":28,"ProductRecordCount":53,"DevIdRuleCount":0},{"ReleaseVersion":"6.10.17.152","AnalysisFile":"releases/6.10.17.152/amd-chipset-analysis-6.10.17.152.json","AnalysisSha256":"c94f0d2b112b3bcfa8bcbbab6e178e174c37cc71533e478f5d00cad8fe2783c0","DriverPackageCount":28,"ProductRecordCount":53,"DevIdRuleCount":0},{"ReleaseVersion":"7.02.13.148","AnalysisFile":"releases/7.02.13.148/amd-chipset-analysis-7.02.13.148.json","AnalysisSha256":"29ed36dd867ed34a2edfdcdd789b483a715f40c264af7d7114f54924c2284fcb","DriverPackageCount":30,"ProductRecordCount":59,"DevIdRuleCount":37},{"ReleaseVersion":"7.04.09.545","AnalysisFile":"releases/7.04.09.545/amd-chipset-analysis-7.04.09.545.json","AnalysisSha256":"52bdd5b83591e2c47d7026e1a97e9c7daa0624fa151f64df09b4c20e0eefc44f","DriverPackageCount":30,"ProductRecordCount":59,"DevIdRuleCount":37},{"ReleaseVersion":"7.06.02.123","AnalysisFile":"releases/7.06.02.123/amd-chipset-analysis-7.06.02.123.json","AnalysisSha256":"e6b05cc9ba574e81acad6294200520102eb7e931874519e1d54559222538f8ea","DriverPackageCount":30,"ProductRecordCount":59,"DevIdRuleCount":37},{"ReleaseVersion":"7.11.26.2142","AnalysisFile":"releases/7.11.26.2142/amd-chipset-analysis-7.11.26.2142.json","AnalysisSha256":"082a607fe2ceab8c8a6a5bd3e4e4c95becd9068bbe735dc9358761856209af3e","DriverPackageCount":31,"ProductRecordCount":62,"DevIdRuleCount":38},{"ReleaseVersion":"8.01.20.513","AnalysisFile":"releases/8.01.20.513/amd-chipset-analysis-8.01.20.513.json","AnalysisSha256":"540bda627d652343d2574c808583910b0ef069cbc647e071b01768ebda86f97d","DriverPackageCount":29,"ProductRecordCount":58,"DevIdRuleCount":38},{"ReleaseVersion":"8.02.18.557","AnalysisFile":"releases/8.02.18.557/amd-chipset-analysis-8.02.18.557.json","AnalysisSha256":"1e08855b991f53bc60ac109d9c674e97acbcc7f4421f8f72238c8edb91c3baca","DriverPackageCount":31,"ProductRecordCount":62,"DevIdRuleCount":38},{"ReleaseVersion":"8.05.04.516","AnalysisFile":"releases/8.05.04.516/amd-chipset-analysis-8.05.04.516.json","AnalysisSha256":"f592d88e19019ffe2d2cb3d70692ef3317c7e86e113220fb437c769c7266d510","DriverPackageCount":31,"ProductRecordCount":63,"DevIdRuleCount":39},{"ReleaseVersion":"8.07.16.1035","AnalysisFile":"releases/8.07.16.1035/amd-chipset-analysis-8.07.16.1035.json","AnalysisSha256":"9b8eb0c929f2bedd85d2941c083a82ff2de44e45220769300f26ff98aed85348","DriverPackageCount":31,"ProductRecordCount":64,"DevIdRuleCount":41}]}
